{
  "schemaVersion": "mindclade.dev/scientific-model-intake-decision/v1",
  "intakeDigest": "sha256:1818181818181818181818181818181818181818181818181818181818181818",
  "policyDigest": "sha256:abababababababababababababababababababababababababababababababab",
  "accepted": true,
  "rejectionReasons": [],
  "attestationDigests": [
    "sha256:1010101010101010101010101010101010101010101010101010101010101010",
    "sha256:1212121212121212121212121212121212121212121212121212121212121212",
    "sha256:1313131313131313131313131313131313131313131313131313131313131313",
    "sha256:1414141414141414141414141414141414141414141414141414141414141414",
    "sha256:1515151515151515151515151515151515151515151515151515151515151515",
    "sha256:1616161616161616161616161616161616161616161616161616161616161616",
    "sha256:1717171717171717171717171717171717171717171717171717171717171717"
  ],
  "authorizationScope": "implementation-only"
}
